{
  "$schema":"https://json-schema.org/draft/2020-12/schema","$id":"https://aese.local/world/v1/world-event.schema.json","type":"object","additionalProperties":false,
  "required":["schema_version","event_id","event_type","tenant_id","world_run_id","branch_id","sim_occurred_at","recorded_at","priority","sequence","correlation_id","idempotency_key","rules_version","subject_ref","payload_type","payload","state_hash_before","state_hash_after"],
  "properties":{"schema_version":{"const":"1.0"},"event_id":{"$ref":"common.schema.json#/$defs/id"},"event_type":{"$ref":"common.schema.json#/$defs/id"},"tenant_id":{"$ref":"common.schema.json#/$defs/id"},"world_run_id":{"$ref":"common.schema.json#/$defs/id"},"branch_id":{"const":"main"},"sim_occurred_at":{"$ref":"common.schema.json#/$defs/rfc3339"},"recorded_at":{"$ref":"common.schema.json#/$defs/rfc3339"},"priority":{"type":"integer"},"sequence":{"type":"integer","minimum":0},"correlation_id":{"$ref":"common.schema.json#/$defs/id"},"causation_id":{"type":"string"},"idempotency_key":{"$ref":"common.schema.json#/$defs/id"},"rules_version":{"$ref":"common.schema.json#/$defs/id"},"subject_ref":{"$ref":"common.schema.json#/$defs/stable_ref"},"payload_type":{"$ref":"common.schema.json#/$defs/id"},"payload":{"type":"object"},"state_hash_before":{"$ref":"common.schema.json#/$defs/hash"},"state_hash_after":{"$ref":"common.schema.json#/$defs/hash"}}
}
