{"schema_version":"1.0","event_id":"world-event-vibration-rise-01","event_type":"equipment.vibration.increased.v1","tenant_id":"tenant-hctm","world_run_id":"world-run-genesis-001","branch_id":"main","sim_occurred_at":"2026-07-08T10:15:00+08:00","recorded_at":"2026-07-22T04:00:00Z","priority":100,"sequence":1,"correlation_id":"corr-equipment-degradation-01","idempotency_key":"world-run-genesis-001:event:vibration-rise:1","rules_version":"rules-0.1.0","subject_ref":{"namespace":"hctm","type":"equipment","code":"LAS-WLD-02"},"payload_type":"equipment.vibration.increased.v1","payload":{"measurement":{"value":"7.20","unit":"mm/s","scale":2}},"state_hash_before":"sha256:0000000000000000000000000000000000000000000000000000000000000000","state_hash_after":"sha256:1111111111111111111111111111111111111111111111111111111111111111"}
